id,name,description,mitigation
"svd_02_HR","vulnerable_svds","All SVDs mitigated",""
"svd_03_HR","manual_check_req","Manual checks are done",""
"svd_04_HR","indexer_tls","Indexers are configured to receive encrypted traffic",""
"svd_05_HR","webserver_https","Webserver access is secured by HTTPS",""
"svd_06_HR","signature_version","Splunk signatureVersion protocol v2 is used",""
"svd_07_HR","python_https","PYTHON HTTPS verification is set",""
"svd_08_HR","core_supported","Current Splunk Enterprise version is still supported",""
"svd_09_HR","uf_supported","All Universal Forwarder (UF) versions are still supported",""
"svd_10_HR","kernel_supported","All currently used Linux kernel versions are still supported",""
"svd_11_HR","es_supported","Current version of Enterprise Security supported",""
"svd_12_HR","itsi_supported","Current version of IT Service Intelligence supported",""
"svd_13_HR","ds_dc_auth","Deployment Server authentication enabled",""
"svd_14_HR","OS_filesystem_check","Splunk directory not owned by root and permissions are set correct",""
"svd_15_HR","default-web-cert","Custom Webserver Certificate is used",""
"svd_16_HR","webserver_hardening","Webserver hardening is done","In web.conf, the following settings should apply allowSslRenegotiation=0, sendStrictTransportSecurityHeader=1, sslVersions=tls1.2, enable_insecure_login=0, "
"svd_17_HR","selinux_status","SELinux is enabled on all instances",""
"svd_18_HR","uf_mgmt_port","Looking for config in deployment-apps: UFs should not have their management port open",""
"svd_19_HR","idx_dic","All indexes have dataIntegrityControl enabled",""
"svd_20_HR","hec_secure","HEC is secured by HTTPS and token config is hardened",""
"svd_21_HR","idx_web_disabled","Indexer Webserver Service disabled",""
"svd_22_HR","base_apps","At least one base app was found (best practice)",""
"svd_23_HR","nacls","Splunk Network ACLs are in place",""
"svd_24_HR","mail_domains","Alert Actions: outgoing mail domains restricted",""
"svd_25_HR","ntp","NTP service is configured on all Splunk instances and synchronized",""
"svd_26_HR","sva","A Splunk Validated Architectures (SVA) Mapping was successful",""
"svd_27_HR","cert_expiration","No certificate expiration in the next 30 days",""
